book_name;book_author
O LIVRO COM FOME ;ANDRÉ MADALENO
O LIVRO COMPLETO DAS PRINCESAS;WALT DISNEY
O LIVRO DA AVÓ;LUÍS SILVA
O LIVRO DA AVÓ ALICE;ALICE VIEIRA
O LIVRO DA SELVA;RUDYARD KIPLING
O LIVRO DA SELVA;WALT DISNEY
O LIVRO DA SELVA- AS AVENTURAS DE MOGLI ;WALT DISNEY
O LIVRO DA TILA;MATILDE ROSA ARAÚJO
O LIVRO DA VOVÓ PATA;ROSA LOBATO DE FARIA
O LIVRO DAS ADIVINHAS;ANTÓNIO MOTA
O LIVRO DAS ADIVINHAS 1;ANTÓNIO MOTA
O LIVRO DAS BOAS MANEIRAS;WALT DISNEY
O LIVRO DAS BOAS-NOITES;JOSÉ JORGE LETRIA
O LIVRO DAS DATAS;LUÍSA DUCLA SOARES
O LIVRO DAS EMOÇÕES;FILIPA SÁRAGGA
O LIVRO DAS LENGALENGAS 1;ANTÓNIO MOTA
O LIVRO DAS MELHORES AMIGAS;LARA JENNINGS
O LIVRO DAS MINHAS EMOÇÓES;STÉPHANIE COUTURIER
O LIVRO DAS OITO HISTÓRIAS VOL. 1;VÁRIOS
O LIVRO DAS PIADAS SECAS E NÃO SÓ!;JOSÉ MANUEL CARVALHO
O LIVRO DO APRENDIZ DE FEITICEIRO;ANDY LEE
O LIVRO DO APRENDIZ DE FEITICEIRO;LINDY BURNETT
O LIVRO DO NATAL;JOSÉ JORGE LETRIA
O LIVRO DO NATAL;MARIA ALBERTA MENÉRES
O LIVRO DOS CORAÇÕES;LUCIANA GRAÇA
O LIVRO DOS EXAGEROS;ANTÓNIO MOTA
O LIVRO DOS GRANDES OPOSTOS FILOSÓFICOS;OSCAR BRENIFIER
O LIVRO DOS PORQUÊS;FEDERICA MAGRIN
O LIVRO DOS PORQUINHOS;ANTHONY BROWNE
O LIVRO DOS QUINTAIS;BERNARDO P. CARVALHO 
O LIVRO DOS QUINTAIS;ISABEL MINHÓS MARTINS
O LIVRO DOS SENTIMENTOS;TODD PARR
O LIVRO INCLINADO;PETER NEWELL
O LIVRO INCLINADO ;PETER NEWELL
O LIVRO MÁGICO PARA JOVENS BRUXAS;ARIEL KUSBY
O LIVRO QUE LÊ GENTE;ALEXANDRO DE CASTRO GOMES
O LIVRO QUE SÓ QUERIA SER LIDO ;JOSÉ JORGE LETRIA
O LIVRO QUE VOA;PIERRE LAURY
O LIVRO SEM BONECOS;B. J. NOVAK
O LIXO NO LIXO;ESTHER BAYÓN
O LIXO NO LIXO;ESTHER GONZÁLEZ BAYÓN
O LOBO COM BOM CORAÇÃO;ELVIRA FERREIRA
O LOBO E O CORDEIRO;ANA OOM (ADAPT.)
O LOBO E OS 7 CABRITINHOS;NATHALIE CHOUX
O LOBO E OS SETE CABRITINHOS;IRMÃOS GRIMM
O LOBO E OS SETE CABRITINHOS;NICOLE VIROUX-LENAERTS
O LOBO QUE DESCOBRIU O PAÍS DOS CONTOS;ORIANNE LALLEMAND
O LOBO QUE ENCONTROU A AMIZADE;RACHEL BRIGHT
O LOBO QUE ESTAVA FARTO DE ANDAR;ORIANNE LALLEMAND
O LOBO QUE NÃO GOSTAVA DE LER;ORIANNE LALLEMAND
O LOBO QUE PARTIU À DESCOBERTA DO MUSEU;ORIANNE LALLEMAND
O LOBO QUE QUERIA MUDAR DE COR;ORIANNE LALLEMAND
O LOBO QUE QUERIA SER ARTISTA;ORIANNE LALLEMAND
O LOBO QUE QUERIA UMA FESTA DE ANOS;ORIANNE LALLEMAND
O LOBO QUE SE ACHAVA O MAIOR;ORIANNE LALLEMAND
O LOBO QUE SONHAVA COM O OCEANO;ORIANNE LALLEMAND
O LOBO QUE TINHA A CABEÇA NA LUA;ORIANNE LALLEMAND
O LOBO QUE VIAJAVA NO TEMPO;ORIANNE LALLEMAND
Ó MÃÃÃEEE!;ILAN BRENMAN
O MACACO DE RABO CORTADO;ANA OOM (ADAPT.)
O MACACO DE RABO CORTADO;ANTÓNIO TORRADO
O MACACO DE RABO CORTADO;JOANA M. LOPES
O MACACO E A VIOLA;ANA MARIA MACHADO
O MACACO E O CROCODILO;LÚCIA VIDAL SOARES
O MACACO QUE FICOU SEM RABO;LUÍSA DUCLA SOARES
O MACAQUINHO DE IMITAÇÃO;NICHA ALVIM
O MAGNETISMO;ANTONELHA MEIAMI-MARUS ED
O MAIOR, O MAIS PERIGOSO E OUTROS ANIMAIS FABULOSOS;JOZUA DOUGLAS
O MAIS ESPECTACULAR ATLAS DO MUNDO INTEIRO PELOS GENIOZINHOS;VÁRIOS
O MANUSCRITO MISTERIOSO;GERONIMO STILTON
O MAR ;ANDRÉ POZNER
O MARINHEIRO;DICK BRUNA
O MATA-PESADELOS;ISABEL STILWELL
O MÉDICO DO MAR;LEO TIMMERS
O MÉDICO DO MAR ;LEO TIMMERS
O MELHOR AMIGO DAS CRIANÇAS;VÁRIOS
O MELHOR PRESENTE DO MUNDO;MARK SPERRING
"O MENINO DA LUA; CORRE, CORRE, CABACINHA";ALICE VIEIRA
O MENINO DE AMARELO E A BORBOLETA BRANCA;JOANA VIEIRA
O MENINO E A NUVEM;LUÍSA DUCLA SOARES
O MENINO ESCRITOR;ROSÁRIO ALÇADA ARAÚJO
O MENINO ETERNO;JOSÉ JORGE LETRIA
O MENINO GORDO;JOSÉ VIALE MOUTINHO
O MENINO MALUQUINHO;ZIRALDO ALVES PINTO
O MENINO QUE COLECIONAVA PALAVRAS;PETER HAMILTON REYNOLDS
O MENINO QUE GRITOU PARA DENTRO;ANA VENTURA
O MENINO QUE NÃO GOSTAVA DE LER;SUSANNA TAMARO
O MENINO QUE NÃO GOSTAVA DE SOPA;CIDÁLIA FERNANDES
O MENINO RECOMPENSADO;ANTÓNIO BOTTO
O MEU AMIGO DE OUTRO MUNDO ;ROSS MONTGOMERY
O MEU AMIGO ZECA TUM-TUM E OS OUTROS;JOSÉ FANHA
O MEU ATLAS DESDOBRÁVEL DOS DINOSSAUROS;VÁRIOS
O MEU AVÔ;CATARINA SOBRAL
O MEU AVÔ CONSEGUE VOAR!;PEDRO SEROMENHO
O MEU AVÔ FOI PARA O CÉU;MARIA TERESA MAIA GONZALEZ
O MEU CORAÇÃO;CORINNA LUYKEN
O MEU CORPO O TEU CORPO;MICK MANNING
O MEU DIÁRIO TOP SECRET- EM DIGRESSÃO PELA AMÉRICA;DEE SHULMAN
O MEU GATINHO MORREU;RUTE PINTO
O MEU LIVRO;PEDRO REISINHO
O MEU LIVRO DE ATIVIDADES COM DINOSSAUROS;DOUGAL DIXON
O MEU LIVRO DE BICICLETAS;CATARINA FREITAS ET AL
O MEU LIVRO TEM BICHO;MADALENA DA LUZ COSTA
O MEU PRIMEIRO ÁLBUM DE POESIA;ALICE VIIERA
O MEU PRIMEIRO LIVRO DAS GRANDES QUESTÕES;AA.VV.
O MEU PRIMEIRO LIVRO DAS GRANDES QUESTÕES;VÁRIOS
O MEU PRIMEIRO LIVRO- O NATAL;DIANA DIAS
O MEU SONHO DE... FADA;ÉMILIE BEAUMONT
O MEU SONHO É MAIOR QUE O TEU;VERGÍLIO ALBERTO VIEIRA
O MEU SONHO É MAIOR QUE O TEU ;VERGÍLIO ALBERTO VIEIRA
O MEU TETRAVÔ... ERA UM GUERREIRO!;RICARDO FRANCAVIGLIA
O MISTÉRIO DA MINHA VIZINHA;SYLVIE RAINAUD
O MISTÉRIO DA PIRÂMIDE DE QUEIJO;GERONIMO STILTON
O MISTÉRIO DA TERRA;CLARA NUNES
O MISTÉRIO DO FARAÓ;JOÃO AGUIAR
O MISTÉRIO DO LADRÃO INVISÍVEL;ENID BLYTON
O MISTÉRIO DO NEVÃO ASSOMBRADO;CARLOS CORREIA ET AL
O MISTÉRIO DO OLHO DE ESMERALDA;GERONIMO STILTON
O MISTÉRIO DO OLHO VIVO;ALFRED HITCHCOCK
O MISTÉRIO DOS ELFOS;GERONIMO STILTON
O MISTERIOSO LADRÃO DE QUEIJOS;GERONIMO STILTON
O MONSTRO DA VERGONHA;TÂNIA CARNEIRO
O MONSTRO DAS CORES;ANNA LLENAS
O MONSTRO DAS CORES;ANNA LLENNAS
O MONSTRO DAS CORES ;ANNA LLENAS
O MONSTRO DAS CORES VAI À ESCOLA;ANNA LLENAS
O MONSTRO DAS FESTINHAS;CARLA ANTUNES
O MONSTRO MARINHO OCRE;PEDRO LEITÃO
O MONSTRO QUE VEIO DO GELO;DAVID WALLIAMS
O MORCEGO BIBLIOTECÁRIO;CARMEN ZITA FERREIRA
O MUITO GRANDE PEQUENO POLEGAR;CHARLES PERRAULT
O MUNDO ASSUSTADOR DOS DINOSSAUROS;PAT JACOBS
O MUNDO DA CARLOTA Nº 1: COM MIL COELHOS;ALICE PANTERMULLER
O MUNDO DA INÊS - A ENTRADA NO COLÉGIO;SARA DE ALMEIDA LEITE
O MUNDO DA INÊS - FÉRIAS ATRIBULADAS;SARA DE ALMEIDA LEITE
O MUNDO DA INÊS- A ENTRADA NO COLÉGIO;SARA DE ALMEIDA LEITE
O MUNDO DA INÊS- AOS 13 TUDO SE COMPLICA;SARA DE ALMEIDA LEITE
O MUNDO DA INÊS- COMO SOBREVIVER À ADOLESCÊNCIA;SARA DE ALMEIDA LEITE
O MUNDO DA INÊS- MEDOS NÃO HÁ QUEM NÃO TENHA;SARA DE ALMEIDA LEITE
O MUNDO DAS PALAVRAS;LEE DAVIS
O MUNDO DE LÁ (LIVRO 8 CRÓNICAS VAMPIRO VALENTIM);ÁLVARO MAGALHÃES
O MUNDO DOS AMIGOS ESTRELA- TRUQUES SOMBRIOS;LINDA CHAPMAN
O MUNDO FANTÁSTICO DE TOM GATES;LIZ PICHON
O MUNDO MARAVILHOSO DOS ANIMAIS- OS LEOPARDOS;WALT DISNEY
O MUNDO MARAVILHOSO DOS DINOSSAUROS;WALT DISNEY
O MUNDO SEGUNDO FELIPE NETO- VERDADES HLÁRIAS DA VIDA;FELIPE NETO
O MURO NO MEIO DO LIVRO;JON AGEE
O NABO GIGANTE;ALEXIS TOLSTOI
O NAMORADO NOVO DA MÃE;ANKE WAGNER
O NARCISO COM PELOS NO NARIZ;ANDREIA PENSO PEREIRA
O NATAL DO BOLINHA;ERIC HILL
O NATAL DO ELMER;DAVID MCKEE
O NATAL DO LOBO PEPE;ÁLVARO PECEGUEIRO
O NATAL DO PANDA;ODA TARO
O NATAL DO RATO RENATO;ANNA CASALIS
O NATAL ESPECIAL DA RENA RUBI;STELLA GURNEY
O NATAL ESTÁ A CHEGAR!;FRANCESCA PESCI ET AL
O NOSSO CÃOZINHO;ANNE CIVARDI
O NOVELO DA MASSINHAS;SHERYL WEBSTER
O NOVELO DE EMOÇÕES;ELIZABETE NEVES
O NOVO COMPUTADOR DA BRUXA MIMI;VALERIE THOMAS
O PAI GALINHA E O SEU PINTAINHO;BERNARDINO PACHECO
O PAI NATAL VAI Á GUERRA;ARYIRO KOKORELI
O PAI NATAL VERDE;NARCISO MOREIRA
O PAÍS DAS PESSOAS DE PERNAS PARA O AR;MANUEL ANTÓNIO PINA
O PAÍS SEM NÚMEROS;JÚLIO BORGES
O PALHAÇO AVARIA E O PLANETA BATERIA;PEDRO SEROMENHO
O PAPÃO;PABLO ALBO
O PASSARINHO PRETO E A ALEGRIA DE TODAS AS CORES;DORINDO CARVALHO
O PÁSSARO DA ALMA;MICHAL SNUNIT
O PÁSSARO DA AVÓ;BENJI DAVIES
O PÁSSARO DO TEMPO ;NATÁLIA BEBIANO DA PROVIDÊNCIA
O PATINHO FEIO;HANS CHRISTIAN ANDERSEN
O PATINHO NA TERRA DO PAI  NATAL;TERESA PAIXÃO
O PATO AMARELO E O GATO RISCADO;MANUELA CASTRO NEVES
O PEDAÇO QUE FALTA;SHEL SILVERSTEIN
O PEDAÇO QUE FALTA;SHEL SILVERSTINE
O PEIXE ARCO-ÍRIS;MARCUS PFISTER
O PEIXINHO DOURADO E O LÁPIS MÁGICO;PAULA VIOTTI
O PEQUENO CARRO VERMELHO;NICOLA BAXTER
O PEQUENO COELHO E O BONECO DE NEVE MÁGICO;CATHERINE WALTERS 
O PEQUENO DRAGÃO-D'ÁGUA;GENEVIÈVE CORDELLE
O PEQUENO INVENTOR;HYUN DUK
O PEQUENO LIVRO DOS MEDOS;SÉRGIO GODINHO
O PEQUENO NICOLAU;JEAN SEMPÉ
O PEQUENO PAI NATAL VAI À CIDADE;ANU STOHNER
O PEQUENO POLEGAR;CHARLES PERRAULT
O PEQUENO POLEGAR;GAUTHIER DOSIMONT
O PERIGO ESTÁ EM TODO LADO;DAVID O'DOHERTY
O PERU QUE VOTOU A FAVOR DO NATAL;MADELEINE COOK
O PINGUIM QUE ODIAVA O FRIO;WALT DISNEY
O PINÓQUIO;ANA OOM (ADAPT.)
O PINTINHO AMARELINHO;VÁRIOS
O PINTO CARECA;MARISA NÚÑEZ
O PINTO PANÇUDO;ANTÓNIO TORRADO
O PIRATA PATA DE LATA;XOSÉ MANUEL GONZÁLEZ
O PIRATINHA SALVA O TAGARELA;DANIELA MAGALHÃES ET AL
O PIRILAMPO DA RITA ;MARIA DA GRAÇA DE RIOS VILELA
O PLANETA AZUL;LUÍSA DUCLA SOARES
O PLANETA BRANCO;MIGUEL SOUSA TAVARES
O PLANETA DE CRISTAL;JÚLIO ISIDRO
O PLANETA DE CRISTAL (PRIMOS ESPECIAIS E ESPACIAIS);JÚLIO ISIDRO
O PLANETA LIMPO DO FILIPE PINTO!;FILIPE PINTO
O POLVO COCEGUINHAS;RUTH GALLOWAY
O POMBO PRECISA DE UM BANHO!;MO WILLEMS
O PONTO;PETER HAMILTON REYNOLDS
O PORQUINHO DE NATAL ;J. K. ROWLING
O PRIMEIRO DIA DE ESCOLA;ANTÓNIO MOTA
O PRIMEIRO PAÍS DA MANHÃ;RICARDO GONÇALVES DIAS
O PRÍNCIPE COM ORELHAS DE BURRO;JOSÉ RÉGIO
O PRÍNCIPE FELIZ;OSCAR WILDE
O PRÍNCIPE FELIZ E OUTRAS HISTÓRIAS;OSCAR WILDE
O PRÍNCIPE QUE GUARDAVA OVELHAS;LUÍSA DUCLA SOARES
O PRÍNCIPE SAPO;JANE PORTER
O PRINCIPEZINHO;ANTOINE DE SAINT-EXUPÉRY
O PRINCIPEZINHO;ANTOINE SAINT-EXUPÉRY
O PRINCIPEZINHO E O PÁSSARO DE FOGO;KATHERINE QUENOT
O PROTESTO;EDUARDA LIMA
O PROTESTO DO LOBO MAU;MARIA LEITÃO
O QUE É O AMOR?;DAVIDE CALI
O QUE É O AMOR?;JOSÉ JORGE LETRIA
O QUE HÁ DEBAIXO DA CAMA?;ROSIE GREENING
O QUE SÃO A BELEZA E A ARTE? - FILOSOFIA PARA CRIANÇAS;OSCAR BRENIFIER
O QUE VAMOS CONSTRUIR;OLIVER JEFFERS
O QUE VAMOS CONTAR?;ANA MARIA MAGALHÃES E ISABEL ALÇADA
O QUEBRA-NOZES ;E. T. A. HOFFMANN
O RABO DO ESQUILO;LARA XAVIER
O RABO DO RATO;ANTÓNIO TORRADO
O RAPAZ AO FUNDO DA SALA;ONJALI Q. RAÚF
O RAPAZ DE BRONZE;SOPHIA DE MELLO BREYNER ANDRESEN 
O RAPAZ DO PIJAMA ÀS RISCAS;JOHN BOYNE
O RAPAZ DOS HIPOPÓTAMOS;MARGARET MAHY
O RAPAZ E O ROBÔ;LUÍSA DUCLA SOARES
O RAPAZ MILIONÁRIO;DAVID WALLIAMS
O RAPAZ QUE DESPEJOU O MAR;PAUL BROWN
O RAPAZ QUE GOSTAVA DE AVES (E DE MUITAS OUTRAS COISAS);ISABEL MINHÓS MARTINS
O RAPAZ QUE TINHA ZERO A MATEMÁTICA;LUÍSA DUCLA SOARES
O RAPAZ SEM ORELHAS DE BURRO;JOÃO MANUEL RIBEIRO
O RATINHO E O MURO VERMELHO;BRITTA TECKENTRUP
O RATINHO MARINHEIRO;LUÍSA DUCLA SOARES
O RATINHO POETA;LUÍSA DUCLA SOARES
O RATINHO TORTO;ANA BEATRIZ AFONSO
O RATO ARTUR;ZACARIAS
O RATO DA CIDADE E O RATO DO CAMPO ;LADYBIRD
O RATO DO CAMPO E O RATO DA CIDADE;ESOPO
O RATO DO CAMPO E O RATO DA CIDADE;JEAN DE LA FONTAINE
O RATO DO CAMPO E O RATO DA CIDADE ;ESOPO
O RATO E O LEÃO;ANA OOM
O RATO QUE CANCELOU O NATAL;MADELEINE COOK
O RATO RENATO;ANA CASALIE
O RATO RENATO;ANNA CASALIS
O RATO RENATO- AS REGRAS SÃO IMPORTANTES!;VALENTINA MAZZOLA
O RATO RENATO DIZ MENTIRAS;VALENTINA MAZZOLA
O RATO RENATO- NÃO ME APETECE IR DORMIR!;MARCO CAMPANELLA
O RATO RENATO- NÃO ME APETECE IR DORMIR!;VALENTINA MAZZOLA
O RATO RENATO NÃO QUER COMER;ANNA CASALIS, MARCO CAMPANELLA , SARA COSTA
O RATO RENATO NÃO QUER TOMAR BANHO;ANNA CASALIS
O RATO RENATO- NÃO QUERO IR AO MÉDICO!;VALENTINA MAZZOLA
O RATO RENATO TEM MEDO;ANNA CASALIS
O RATO RENATO TEM MEDO ;ANNA CASALIS E MARCO CAMPANELLA
O RATO RENATO- TENHO MEDO DO ESCURO!;VALENTINA MAZZOLA
O RATO RENATO VAI TER UM IRMÃO;ANNA CASALIS
O RATO SOLTEIRO ;PACO LIVÁN
O REBANHO PERDEU AS ASAS;ANTÓNIO MOTA
O RECRUTA;ROBERT MUCHAMORE
O REGRESSO A NÁRNIA- O RESGATE DO PRÍNCIPE CASPIAN;C. S. LEWIS
O REGRESSO AO CASTELO DO LORDE AVARENTO;GERONIMO STILTON
O REGRESSO DA BALEIA;BENJI DAVIES
O REI BATOTEIRO;MARGARIDA CASTEL-BRANCO
O REI COTA;MARGARIDA CASTEL-BRANCO
O REI E A ESTRELA;VANDA FURTADO MARQUES
O REI FIXOLAS E O IMPERADOR MALVADO;ANDY RILEY
O REI INCHADO;MARIA JOÃO LOPES
O REI LEÃO;ELIZABETH RUDNICK
O REI LEÃO;VÁRIOS
O REI LEÃO;WALT DISNEY
O REI MENINO;ANTÓNIO TORRADO
O REI MIDAS;ALEX HIRSH
O REI RIQUE E OUTRAS HISTORIAS;ILSE LOSA
O REI RIQUE E OUTRAS HISTÓRIAS;ILSE LOSA
O REI VAI NU;ANA OOM
O REI VAI NU;HANS CHRISTIAN ANDERSEN
O REINO PERDIDO ;ÁLVARO MAGALHÃES
O RELÓGIO DA MINHA AVÓ;GERALDINE MCCAUGHREAN
O RESGATE DO ORELHAS FOFAS;EMMA CHICHESTER CLARK
O RINOCERONTE MUITO MALCRIADO;JEANNE WILLIS
O ROSTO DA AVÓ;SIMONA CIRAOLO
O ROUXINOL;HANS CHRISTIAN ANDERSEN
O ROUXINOL E A SUA NAMORADA;SIDÓNIO MURALHA
O ROUXINOL E O IMPERADOR DA CHINA;HANS CHRISTIAN ANDERSEN
O ROWLEY APRESENTA- UMA AVENTURA SUPIMPA;JEFF KINNEY
O SAPO APAIXONADO;MAX VELTHUIJS
O SAPO E O CANTO DO MELRO;MAX VELTHUIJS
O SAPO ENCONTRA UM AMIGO;MAX VELTHUIJS
O SECADOR DE LIVROS;CARLA MAIA DE ALMEIDA
O SÉCULO MAIS NOVO DO MUNDO;TERESA DURAN
O SEGREDO DA AVÓ;JOÃO BORGES DE OLIVEIRA
O SEGREDO DA ESFINGE;GERONIMO STILTON ET AL
O SEGREDO DA LAGARTA SERAFINA;PALMIRA MARTINS
O SEGREDO DA TARTARUGA HUGA;ANNA OBIOLS
O SEGREDO DE LEONARDO DA VINCI;GERONIMO STILTON
O SEGREDO DO AVÔ URSO;PEDRO MANÃS
O SEGREDO DO CONDE DA FAIA;MARIA JOÃO LOPO DE CARVALHO
O SEGREDO DO CROCODILO NINO ;K. G. STONE
O SEGREDO DO PAPA-FORMIGAS;BEATRIZ OSÉS
O SEGREDO DO RIO ;MIGUEL SOUSA TAVARES
O SENHOR CAVALO-MARINHO;ERIC CARLE
O SENHOR DE CORINDE;RAUL CORREIA
O SENHOR DO SEU NARIZ E OUTRAS HISTÓRIAS;ÁLVARO MAGALHÃES
O SENHOR DO SEU NARIZ E OUTRAS HISTÓRIAS ;ÁLVARO MAGALHÃES
O SENTIDO DA VIDA;OSCAR BRENIFIER
O SEXTO ANO NO COLÉGIO DE SANTA CLARA;ENID BLYTON
O SILÊNCIO DA ÁGUA;JOSÉ SARAMAGO
Ó SIMÃO, SEU TRAPALHÃO, JÁ ARMASTE CONFUSÃO! ;CARLOS ALBERTO SILVA
O SOLDADINHO DE CHUMBO;HANS CHRISTIAN ANDERSEN
O SOLDADO JOÃO;LUÍSA DUCLA SOARES
O SONHO DA RECICLAGEM;RITA SOFIA FERREIRA
O SONHO DE CRISTIANO;ANDREIA VIDAL
O SONHO DE MARIANA;ANTÓNIO MOTA
O SONHO DE MARIANA ;ANTÓNIO MOTA
O SONHO DO CRISTIANO;ANDREIA VIDAL
O SONHO É…;JOSÉ JORGE LETRIA
O SORRISO DE MONA RATISA;GERONIMO STILTON
O SR. TIGRE TORNA-SE SELVAGEM;PETER BROWN
O SUPER LEITÃO COR DE LARANJA ;PEDRO LEITÃO
O SUPER LEITÃO COR DE LARANJA ;PEDRO LEITÃO.
O TAPETE VOADOR DA MIMI ;VALERIE THOMAS
O TEMPLO DO RUBI DE FOGO;GERONIMO STILTON
O TÊPLUQUÊ E OUTRAS HISTÓRIAS;MANUEL ANTÓNIO PINA
O TÊPLUQUÊ E OUTRAS HISTÓRIAS ;MANUEL ANTÓNIO PINA
O TESOURO;MANUEL ANTÓNIO PINA
O TESOURO DO CASTELO DO REI;ANABELA MIMOSO
O TESOURO DOS ANTIGOS MAIAS;GERONIMO STILTON
O TESOURO DOS GOLFINHOS AZUIS;TEA STILTON
O TEU CORPO É TEU! ;RACHEL BRIAN
O TIO DESAFIO;ANA MARIA MAGALHÃES E ISABEL ALÇADA
O TOM RATÃO E A RATA TOMASA;MARISA NÚÑEZ
O TOQUE DO DRAGÃO;SARAH PRINEAS
O TRASEIRO DO REI;RAQUEL SAIZ
O TRONO DO REI ESCAMIRO;ANTÓNIO TORRADO
O TUBARÃO NA BANHEIRA;DAVID MACHADO
O TUCANO;GAIA VOLPICELLI
O ÚLTIMO DOS MOICANOS;JAMES FENIMORE COOPER
O UNIVERSO;VÁRIOS
O UNIVERSO TODO DENTRO DE MIM?!!;FÁTIMA ÉFFE
O URSO BARULHINHOS;NORBERT LANDA
O URSO E A FORMIGA;LUÍSA DUCLA SOARES
O URSO E O PIANO;DAVID LITCHFIELD
O URSO RESMUNGÃO;STEVE SMALLMAN
O VALE DOS MOINHOS;NOELIA BLANCO
O VALOR DA AUDÁCIA : A HISTÓRIA DO CAPITÃO COOK;ANN DONEGAN JOHNSON
O VAMPIRO DO DENTE DE OURO (TRIÂNGULO JOTA);ÁLVARO MAGALHÃES
O VEADO FLORIDO;ANTÓNIO TORRADO
O VELEIRO FANTASMA ;TEA STILTON
O VELHO E O MAR;ERNEST HEMINGWAY
O VELHO, O RAPAZ E O BURRO;FÁTIMA SOBRAL
O VELOCIRAPTOR ,VOLUME7, O MUNDO DOS DINOSSAUROS;ANTONELLA ANTONELLI E AUGUSTO MACCHETTO
O VENTO BATEU À PORTA;CARLOS PAIXÃO
O VOO DA JOANINHA;MARIA ANTÓNIA AZEVEDO
O VOO DO GOLFINHO;ONDJAKI
O ZÉ E AS ESTAÇÕES;LUÍSA DUCLA SOARES
OBÉLIX E COMPANHIA;RENÉ GOSCINNY
OBRIGADO POR TOMARES CONTA DOS NOSSOS ANIMAIS DE ESTIMAÇÃO;TIM HOPGOOD
OCTOCUECAS;SUZY SENIOR
OH!;JOSSE GOFFIN
OH! UM CÃO COMEU O MEU TRABALHO DE CASA;CHARLES M. SCHULZ
OH, AS CORES!;JORGE LUJÁN
OH, NÃO!;ROTRAUT SUSANNE BERNER
OH, NÃO! ADOTEI UM ELEFANTE!;DAVID WALLIAMS
OH, QUE LINDO QUE É O PANAMÁ;JANOSCH
OLÁ, EU SOU UM LIVRO!;RUI GRÁCIO
OLÁ, FAROL!;SOPHIE BLACKALL
OLÁ, SOU O MARVIN, E NÃO TENHO MEDO DE NADA!;DOMINIQUE MERTENS
OLIVIA;IAN FALCONER
OLÍVIA- A RAPOSA FURIOSA;THOM PICO
OLÍVIA- O GÉNIO ESPERTALHÃO;TOM PICO
OMBELA- A ORIGEM DAS CHUVAS;ONDJAKI
ONDE ACABA O ARCO-ÍRIS;ANA VICENTE
ONDE COMEÇA A FELICIDADE;EVA ELAND
ONDE COMEÇA A FELICIDADE ;EVA ELAND
ONDE ESTÁ A MINHA MÃE?;ANTÓNIO MOTA
ONDE ESTÁ O WALLY?;MARTIN HANDFORD
ONDE ESTÁS, MIMIKO?;BRIGITTE WENINGER
ONDE METO O MEU NARIZ?;CONCEIÇÃO AREIAS
ONZE DAMAS ATREVIDAS;XOSÉ GONZÁLEZ
ONZE DAMAS ATREVIDAS;XOSÉ M. GONZÁLEZ
ORELHAS ÀS AVESSAS;NEIL CONNELLY
ORELHAS DE BORBOLETA;LUISA AGUILAR
OS (MINI)SETE- UMA AVENTURA A CAMINHO DE CASA ;ENID BLYTON
OS 101 DÁLMATAS;DODIE SMITH
OS 101 DÁLMATAS;WALT DISNEY
OS 102 DÁLMATAS;DODIE SMITH
OS 12 MESES DO ANO EM POP-UP;PEGGY NILLE
OS AMIGOS DA MENINA DO MAR ;RAQUEL GASPAR
OS AMIGOS DE LIA;INÊS DE OLIVEIRA
OS AMORES DO CONQUISTADOR;VITOR MESQUITA
OS ANIMAIS;DANIELLE BECK
OS ANIMAIS;WALT DISNEY
OS ANIMAIS DA FLORESTA;CHRISTOPHE HUBLET
OS ANIMAIS DA QUINTA- A CORUJA ;CHRISTINE SEBOURCE
OS ANIMAIS FANTÁSTICOS;JOSÉ JORGE LETRIA
OS ANIMAIS FANTÁSTICOS ;JOSÉ JORGE LETRIA
OS ANIMAIS SELVAGENS;CHARLES-HENRY VERMONT
OS ARISTOGATOS;WALT DISNEY
OS ARISTOGATOS;
OS BEBÉS DA SELVA;WALT DISNEY
OS BISNAUS VÃO À ESCOLA;JOSÉ FANHA
OS BOLOS PREFERIDOS D´OBÉLIX;RENÉ GOSCINNY
OS BOMBONS ;SILVANA CARNEVALI ROCCA
OS CAVALEIROS DA TÁVOLA REDONDA;LUIZ GALDINO
OS CINCO;ENID BLYTON
OS CINCO E A ILHA DO TESOURO;ENID BLYTON
OS CINCO E A PASSAGEM SECRETA;ENID BLYTON
OS CINCO E O COMBOIO FANTASMA;ENID BLYTON
OS CINCO E O COMBOIO FANTASMA ;ENID BLYTON
OS CINCO E O COMBOIO-FANTASMA;ENID BLYTON
OS CINCO E OS CONTRABANDISTAS;ENID BLYTON
OS CINCO E OS RAPTORES;ENID BLYTON
OS CINCO NA CASA DO MOCHO;ENID BLYTON
OS CINCO NA ILHA DO TESOURO;ENID BLYTON
OS CINCO NO LAGO NEGRO;ENID BLYTON
OS CINCO- NOVA AVENTURA DOS CINCO;ENID BLYTON
OS CINCO VOLTAM À ILHA;ENID BLYTON
OS DESASTRES DE SOFIA;CONDESSA DE SÉGUR
OS DESCENDENTES - A ILHA DOS PERDIDOS;MELISSA DE LA CRUZ
OS DESERTOS;MICHAEL CHINERY
OS DIREITOS VÃO À ESCOLA;CELESTE DE ALMEIDA GONÇALVES
OS ESQUILOS QUE NÃO SABIAM PARTILHAR;RACHEL BRIGHT
OS EXTRATERRESTRES SÃO DOIDOS POR CUECAS;CLAIRE FREEDMAN 
OS HERÓIS DE RAPUNZEL;WALT DISNEY
OS HERÓIS MAIS PODEROSOS DA MARVEL - OS VINGADORES;MIKE CAREY
OS IDIOTAS;ROALD DAHL
OS INCRÍVEIS DINOSSAUROS GIGANTES;MARIE GREENWOOD
OS INDOMÁVEIS F. C. - LIVRO 1: O MUNDO É UMA BOLA;ÁLVARO MAGALHÃES
OS INDOMÁVEIS F. C. - LIVRO 10:  NÃO FAÇAM A BOLA CHORAR;ÁLVARO MAGALHÃES
OS INDOMÁVEIS F. C. - LIVRO 11: OPERAÇÃO BOLA DE FOGO;ÁLVARO MAGALHÃES
OS INDOMÁVEIS F. C. - LIVRO 13: O CRAQUE QUE VEIO DE LONGE;ÁLVARO MAGALHÃES
OS INDOMÁVEIS F. C. - LIVRO 6: E AGORA FUTEBOL A SÉRIO;ÁLVARO MAGALHÃES
OS IRMÃOS KOALA ENSINAM AS BOAS MANEIRAS;VÁRIOS
OS LÁPIS QUE SALVARAM O UNICÓRNIO;MONICA SWEENEY
OS LOBOS QUE VIERAM PARA O JANTAR ;STEVE SMALLMAN
OS MAIS BELOS CONTOS DE GRIMM;IRMÃOS GRIMM
OS MAIS BELOS CONTOS DE PERRAULT;CHARLES PERRAULT
OS MAUZÕES - EPISÓDIO 1;AARON BLABEY
OS MAUZÕES - EPISÓDIO 4;AARON BLABEY
OS MEDOS NÃO DURAM PARA SEMPRE;ELIZABETH VERDICK
OS MELHORES BEIJINHOS;JOANNA WALSH
OS METAIS, NASCIDOS DA TERRA E DO FOGO;JEAN-PIERRE REYMOND
OS MEUS AMIGOS;ANTÓNIO TORRADO
OS MEUS AMIGOS E EU;MARÍA MAÑERU
OS MEUS OLHOS DE AFONSO;CATARINA FURTADO
OS MEUS PEQUENOS HERÓIS- LEONARDO DA VINCI ;JAVIER ALONSO
OS MILAGRES DE MIRANDA ;SIOBHÁN PARKINSON
OS MINI CINCO - BOM TRABALHO, CINCO!;ENID BLYTON
OS MINI CINCO - GRANDE TIM!;ENID BLYTON
OS MINI SETE - UMA AVENTURA A CAMINHO;ENID BLYTON
OS MINI-CINCO - GRANDE TIM!;ENID BLYTON
OS MINI-CINCO- BOM TRABALHO, CINCO!;ENID BLYTON
OS MINI-CINCO- FELIZ NATAL, CINCO!;ENID BLYTON
OS MINI-CINCO- GRANDE TIM!;ENID BLYTON
OS MINI-CINCO- O CORTE DE CABELO DA ZÉ;ENID BLYTON
OS MINI-CINCO- O TIM PERSEGUE UM GATO!;ENID BLYTON
OS MINI-CINCO- OS CINCO SALVAM O CORDEIRINHO;ENID BLYTON
OS MINI-CINCO- UM ANIVERSÁRIO ATRIBULADO!;ENID BLYTON
OS MINI-CINCO- UM MISTÉRIO PARA OS CINCO;ENID BLYTON
OS MINI-CINCO- UMA  TARDE DE PREGUIÇA!;ENID BLYTON
OS MINI-CINCO- UMA AVENTURA NAS FÉRIAS;ENID BLYTON
OS MINI-CINCO- UMA TARDE DE PREGUIÇA!;ENID BLYTON
OS MINIDETETIVES OS PEIXES BRILHAM NO ESCURO?  ;CRESSIDA COWELL
OS MINIDETETIVES- PORQUE CINTILAM AS ESTRELAS?;CRESSIDA COWELL
OS MIUDOS DO PIOLHO E O PIOLHOS DO MIÚDO;RITA TABORDA DUARTE
OS MÚSICOS DE BREMEN;IRMÃOS GRIMM
OS OVOS MISTERIOSOS;LUÍSA DUCLA SOARES
OS PAIS NÃO SABEM, MAS EU EXPLICO;MARIA JOÃO LOPES
OS PIORES PROFS. DO MUNDO;DAVID WALLIAMS
OS PIRATAS DAS CARAÍBAS;WALT DISNEY
OS PORTUGAS NO DAKAR;ELISABETE JACINTO
OS PRIMOS E A BRUXA CARTUXA;ANA MARIA MAGALHÃES E ISABEL ALÇADA
OS PRIMOS E O MAGO ENVERGONHADO;ANA MARIA MAGALHÃES E ISABEL ALÇADA
OS RATINHOS DO MAR;KENNETH STEVENS
OS SAPATOS DO PAI NATAL;JOSÉ FANHA
OS SAPATOS VERMELHOS;HANS CHRISTIAN ANDERSEN
OS SEIS MAGNÍFICOS;IRMÃOS GRIMM
OS SETE CABRITOS;XOSÉ BALLASTEROS
OS TIGRES NA PAREDE;JOANA ESTRELA
OS TRÊS MOSQUETEIROS;ALEXANDRE DUMAS
OS TRÊS PORQUINHOS;ELIZABETH GOLDING
OS TRÊS PORQUINHOS;JOSEPH JACOBS
OS TRÊS PORQUINHOS;JUDY HAMILTON
OS TRÊS PORQUINHOS;LUÍSA DUCLA SOARES
OS TRÊS PORQUINHOS;MARIA ISABEL SOARES
OS TRÊS PORQUINHOS;MIRIAM LATIMER
OS TRÊS PORQUINHOS;MÓNICA BOSOM (ADAPT.)
OS TRÊS PORQUINHOS;SUSANNA DAVIDSON
OS TRÊS PORQUINHOS;WALT DISNEY
OS TRÊS PORQUINHOS;XOSÉ BALLESTEROS
OS TRÊS TERRÍVEIS PORQUINHOS ;LIZ PICHON
OS TRÊS URSOS;WALT DISNEY
OS ÚLTIMOS MIÚDOS NA TERRA - VOL.1;MAX BRALLIER
OS ÚLTIMOS MIÚDOS NA TERRA- A MARCHA DOS ZOMBIS;MAX BRALLIER
OS URSOS NÃO LEEM!;EMMA CHICHESTER CLARK
OS VIZINHOS;EINAT TSARFATI
ÓSCAR E FAÍSCA;CLAIRE FREEDMAN
ÓSCAR- O UNICÓRNIO COMILÃO;LOU CARTER
OU ISTO OU AQUILO;CECÍLIA MEIRELES
OVELHINHA DÁ-ME LÃ;ISABEL MINHÓS MARTINS
OVOS VERDES E PRESUNTO;DR. SEUSS
OWHANA- A MINHA HISTÓRIA, OS MEUS SEGREDOS E AS MINHAS DICAS;ANA CATARINA RIBEIRO
PAFI E O INCÊNDIO NO PARQUE DE MERENDAS ;LARA XAVIER
PAFI ENSINA A POUPAR ÁGUA;LARA XAVIER
PAI NATAL, PAI NATAL, QUEM ÉS TU, AFINAL?;FERNANDO BENTO GOMES
PAI SARILHO;DAVID WALLIAMS
PALAVRAS ILUSTRADAS POESIA E PROSA POÉTICA PARA CRIANÇAS;AKIRA DOS SANTOS
PÂNICO NOS HIMALAIAS;GERONIMO STILTON
PAPÁ DAS PERNAS LONGAS;NADINE BRUN-COSME
PAPUÇA E DENTUÇA;WALT DISNEY
PAPUÇA E DENTUÇA- OS INIMIGOS AMIGOS;WALT DISNEY
PARA LÁ DO OCEANO;TARO GOMI
PARA ONDE FORAM AS CRIANÇAS?;SARA RODI
PARA ONDE FORAM AS CRIANÇAS? NA MINHA RUA;SARA RODI
PARA ONDE VAMOS QUANDO DESAPARECEMOS?;ISABEL MINHÓS MARTINS
PARÁBOLAS DE JESUS E AS SUAS MENSAGENS;MIGUEL DE OLIVEIRA
PASSA UM DIA NA QUINTA;AUTOR DESCONHECIDO
PATINAR COM OS URSOS;ANDREW BREAKSPEARE
PATRULHA PATA- A PODEROSA PATRULHA PATA AO RESGATE!;NICKELODEON
PATRULHA PATA- CACHORROS VOADORES;NICKELODEON
PATRULHA PATA- GATINHA A BORDO!;NICKELODEON
PATRULHA PATA- LÊ COM A SKYE E A EVEREST;NICKELODEON
PATRULHA PATA- MISSÃO CANINA;NICKELODEON
PATRULHA PATA- PARTIDA, LARGADA... MERGULHO!;NICKELODEON
PATRULHA PATA- VAMOS SALVAR O COMBOIO;NICKELODEON
PÉ ANTE PÉ ;LEO LIONNI
PÊ DE PAI;ISABEL MINHÓS MARTINS
PEDRÊS- A GALINHA BAILARINA;PATRÍCIA MARTINS
PEDRITO COELHO- FEBRE DO FUTEBOL!;BEATRIX POTTER
PEDRITO COELHO -FELIZ NATAL;BEATRIX POTTER
PEDRITO COELHO NHAM! NHAM!;BEATRIX POTTER
PEDRO APRENDE A GOSTAR DE FRUTA E LEGUMES ;SEDA DARCAN ÇIFTÇI
PEDRO APRENDE BRICOLAGEM;SANDRINE DEREDEL ROGEON
PEDRO E O LOBO;ESOPO
PEDRO E O LOBO;SERGEI PROKOFIEV
PEDRO E O PINHEIRINHO DE NATAL;SANDRINE DEREDEL ROGEON
PEDRO MALASARTES;ANTÓNIO MOTA
PEDRO NO ESTALEIRO;SANDRINE DEREDEL ROGEON
PEDRO PERDEU O COELHINHO;SANDRINE DEREDEL ROGEON
PEDRO QUER VER TELEVISÃO;SANDRINE DEREDEL ROGEON
PEDRO TEM MEDO DE FANTASMAS;SANDRINE DEREDEL ROGEON
PEDRO VAI AO PARQUE;SANDRINE DEREDEL ROGEON
PELE DE BURRO;MARIA JOÃO RODRIGUES (TRAD.)
PENSA EM GRANDE!;WALT DISNEY
PENSA NUM NÚMERO;JOHNNY BALL
PEPO E ESTELA;HORACIO ELENA
PEQUENAS GRANDES HISTÓRIAS- 101 HISTÓRIAS DE ANIMAIS ;VÁRIOS
PEQUENOS CORAÇÕES VERDES;JOÃO MANUEL RIBEIRO
PEQUENOS EM GRANDE;RICARDO MELO ARAÚJO
PEQUENOS LIVROS SOBRE GRANDES PESSOAS- ANNE FRANK;ISABEL THOMAS
PERDIDA DE RISO;GRAÇA BREIA
PERDIDO E ACHADO;OLIVER JEFFERS
PERIGOSO!;TIM WARNES
PETER PAN;J. M. BARRIE
PETER PAN EM A TERRA DO NUNCA;WALT DISNEY
PHINEAS E FERB 9 - INVERÃO;WALT DISNEY
PICASSO & VAN GOGH - PAREM A TERRA QUE EU QUERO SAIR!;ÁLVARO MAGALHÃES
PICASSO E VAN GOGH - O AMOR NÃO É PARA GATOS;ÁLVARO MAGALHÃES
PIMPOLHO, O PIOLHO;ANTOON KRINGS
PIMPONA, A GALINHA TONTA;MARIA CAROLINA PEREIRA ROSA 
PINGU PERDE A IRMÃ;SIBYLLE VON FLUE
PINGUIM;ANTÓNIO MOTA
PINÓQUIO;WALT DISNEY
PIPI DAS MEIAS ALTAS;ASTRID LINDGREN
PIPIM VAI AO MÉDICO;TIAGO SALGUEIRO
PIPIM, O PINGUIM- A GRANDE VIAGEM ;TIAGO SALGUEIRO
PIRATINHA BRINCALHÃO ;TRINDADE PEREIRA
PIU CAGANITA;TÂNIA BAILÃO LOPES
PJ MASKS - CONFUSÃO NO MUSEU;VÁRIOS
PLANTAS, FUNGOS E LÍQUENES;MARIA ANTONIETTA DEL MORO
PÓ DE ESTRELAS;JORGE SOUSA BRAGA
POCAHONTAS;WALT DISNEY
PODEROSOS HERÓIS MARVEL- VINGADORES - ERA DE ULTRON VOL.1;BRIAN MICHAEL BENDIS
POEMAS COM ANIMAIS;JOSÉ FANHA
POEMAS DA HORTA E OUTRAS VERDURAS;MANUELA LEITÃO
POEMAS DA MENTIRA E DA VERDADE;LUÍSA DUCLA SOARES
POEMAS DA MENTIRA E DA VERDADE ;LUÍSA DUCLA SOARES
POEMAS PARA BRINCALHAR ;JOÃO MANUEL RIBEIRO
POEMAS PEQUENINOS PARA MENINOS E MENINAS;LUÍS INFANTE
POESIAS DE TRAGÉDIA E VERSOS DE COMÉDIA;LAURA MIRPURI
PÕE-TE BOA, AVÓZINHA! ;DEBORAH HAUTZIG
POKÉMON;SATOSHI TAJIRI
PÓNEI MÁGICO- UM DESEJO ESPECIAL;SUE BENTLEY
POR AMOR A MIM;ERIC MANY
POR FAVOR, LEONOR!;MARIE-LOUISE GAY
POR QUE FUI ADOPTADO?;ROSA VARELA
PORQUE É QUE OS ANIMAIS NÃO CONDUZEM?;PEDRO SEROMENHO
PORQUE TEM A ARTE TANTA GENTE NUA?;SUSIE HODGE
PORTA-TE BEM!;JOSÉ JORGE LETRIA
PORTO PORTO;JOÃO PEDRO MÉSSEDER
PORTUGAL PARA MIÚDOS;JOSÉ JORGE LETRIA
POUPAR É GANHAR;RITA PEREIRA
POUPAR É GANHAR!;RITA PEREIRA
POWERPUFF GIRLS - CONTOS DE TOWNSVILLE ;CANDACE BRYAN
PRELÚDIO;PATRÍCIA COSTA
PRESOS;OLIVER JEFFERS
PRIMAVERA / UMA HISTÓRIA POR DIA;ANTÓNIO AVELAR DE PINHO
PRIMEIRAS PERGUNTAS SOBRE AS PLANTAS;GEORGE BEAL
PRIMEIROS PASSOS NO ESTUDO DA NATUREZA;ROY RICHARDS
PRINCESA BAILARINA;VÁRIOS
PRINCESA POPPY - BRINCA AO CARNAVAL;JANEY LOUISE JONES
