book_name;book_author
1, 2, 3 UM REI DE CADA VEZ;SARA REBELLO DA SILVA
1,2,3 - TURMA DA MÓNICA;MAURÍCIO DE SOUSA
100 HISTÓRIAS À LAREIRA: HISTÓRIAS DE ENCANTAR PARA LER DE DIA OU À NOITE, AO DEITAR;ALAIN JOST, IMELDA HEUSCHEN E FRANÇOISE
100 HISTÓRIAS DE TODO O MUNDO;ALVARO MAGALHÃES
100 HISTÓRIAS DO MEU CRESCER;ALEXANDRE HONRADO
101 DÁLMATAS;WALT DISNEY
102 DÁLMATAS;WALT DISNEY
120 HISTÓRIAS PARA ADORMECER;VÁRIOS
1º DIREITO;RICARDO HENRIQUES
2 HISTÓRIAS DE NATAL;ALICE VIEIRA
200 AMIGOS (OU MAIS) PARA UMA VACA;ALESSIA GARILLI
28 HISTÓRIAS PARA RIR;URSULA WÖLFEL
5 MINUTOS DE PAZ;JILL MURPHY
8 HORAS- NA ESCOLA DE QUEIJO!;GERONIMO STILTON
A ALDEIA DAS FLORES;ANTÓNIO MOTA
A ARCA DO TESOURO;ALICE VIEIRA
A ARIA É UMA ALEGRIA;ANA OOM
A ÁRVORE DA ESCOLA;ANTONIO SANDOVAL
A ÁRVORE DA ESCOLA;ANTÓNIO SANDOVAL
A ÁRVORE DA ESCOLA ;ANTONIO SANDOVAL
A AVENTURA NO MAR;ENID BLYTON
A BALEIA  ;BENJI DAVIES
A BARATA DIZ QUE TEM ;ANA OOM
A BELA ADORMECIDA;ANA OOM
A BELA ADORMECIDA;IRMÃOS GRIMM
A BELA DORMECIDA;ANA OOM
A BELA E A FERA ;CLARICE LISPECTOR
A BELA E O MONSTRO;IRMÃOS GRIMM
A BELA E O MONSTRO;JEANNE-MARIE DE BEAUMONT
A BELA E O MONSTRO;JEANNE-MARIE LEPRINCE DE BEAUMONT
A BELA E O MONSTRO;MYRIAM SAYALERO
A BELA E O MONSTRO;WALT DISNEY
A BÍBLIA - ANTIGO TESTAMENTO ;VÁRIOS
A BOLA AMARELA;DANIEL FEHR
A BONECA PALMIRA;MATILDE ROSA ARAÚJO
A BONEQUINHA TAGARELA;FERNANDO TERRA
A BRANCA DE NEVE;IRMÃOS GRIMM
A BRANCA DE NEVE;WALT DISNEY
A BRANCA DE NEVE E OS SETE ANÕES;IRMÃOS GRIMM
A BRANCA DE NEVE E OS SETE ANÕES;VÁRIOS
A BRANCA DE NEVE E OS SETE ANÕES;WALT DISNEY
A BRINCAR, A BRINCAR… VAMOS LÁ RIMAR;ALEXANDRE PARAFITA
A BRUXA ARREGANHADENTES;TINA MEROTO
A BRUXA ARREGANHADENTES ;TINA MEROTO
A BRUXA CARTUXA À PROCURA DO PRIMO ECO;ANA MARIA MAGALHÃES E ISABEL ALÇADA
A BRUXA CARTUXA NA FLORESTA DOS SEGREDOS;ANA MARIA MAGALHÃES E ISABEL ALÇADA
A BRUXA CARTUXA NA ILHA DO TESOURO N.º 4;ISABEL ALÇADA E ANA MARIA MAGALHÃES
A BRUXA CARTUXA NAS PISTAS DA NEVE;ANA MARIA MAGALHÃES E ISABEL ALÇADA
A BRUXA CARTUXA NO CASTELO DAS CINCO TORRES;ANA MARIA MAGALHÃES E ISABEL ALÇADA
A BRUXA CARTUXA NO HOTEL ASSOMBRADO N.º 6;ISABEL ALÇADA E ANA MARIA MAGALHÃES
A BRUXA E O CÃO ;SUE MCMILLAN
A BRUXA MIMI;VALERIE THOMAS
A BRUXA MIMI;VALERIETHOMAS
A BRUXA MIMI E A VARINHA MÁGICA;VALERIE THOMAS
A BRUXA MIMI E O DRAGÃO DA MEIA-NOITE;VALERIE THOMAS
A BRUXA MIMI NO INVERNO;VALERIE THOMAS
A BRUXA MIMI VAI À PRAIA;VALERIE THOMAS
A BRUXA MITUXA;MILU LOUREIRO
A BRUXA NO CASTELO DAS CINCO TORRES;ANA MARIA MAGALHÃES E ISABEL ALÇADA
A BRUXA ZÉZINHA;CARLA ANTUNES
A CABELEIREIRA ENCANTADA E A RAPUNZEL;ABBIE LONGSTAFF
A CAIXA DE SAUDADES;ROSÁRIO ALÇADA ARAÚJO
A CAIXA DE SAUDADES ;ROSÁRIO ALÇADA ARAÚJO
A CAIXA MÁGICA DOS BRINQUEDOS;VÁRIOS
A CAIXA MÁGICA E OUTRAS HISTÓRIAS;RAQUEL DELGADO
A CAMILA FAZ XIXI NAS CALÇAS;NANCY DELVAUX
A CANÇÃO DA BICHARADA ;LUÍSA COSTA GOMES
A CANTIGA DO CAÇADOR E OUTRAS HISTÓRIAS;ANTÓNIO TORRADO
A CAROCHINHA;FÁTIMA SOBRAL
A CAROCHINHA E O JOÃO RATÃO;ANA OOM
A CAROCHINHA E O JOÃO RATÃO;LUÍSA DACOSTA
A CAROCHINHA E O JOÃO RATÃO ;LUÍSA DACOSTA
A CARRINHA MÁGICA;JOANNA COLE
A CASA ASSOMBRADA;VIRGÍNIA WOLF
A CASA DA MOSCA FOSCA;EVA MEJUTO
A CASA MAL ASSOMBRADA;JAN PIENKOWSKI
A CASINHA DE CHOCOLATE;JACOB GRIMM E WILHELM GRIMM
A CASINHA DE CHOCOLATE;JAKOB GRIMM E WILHELM GRIMM
A CASINHA DE TITA CAROCHINHA ;MARIA CAROLINA PEREIRA ROSA
A CIDADE DOS CÃES E OUTRAS HISTÓRIAS;LUÍSA DACOSTA
A CIGARRA E A FORMIGA;JEAN DE LA FONTAINE
A CIGARRA E A FORMIGA;LUÍSA DACOSTA
A COR DAS VOGAIS;VERGÍLIO ALBERTO VIEIRA
A CORAGEM DE TIÇÃO;LUÍS REPRESAS
A COTOVIA VIA... VIA… PORQUE EMIGRAM AS PESSOAS?;ANA MAFALDA DAMIÃO
A DAMA E O VAGABUNDO;CHERYL HOLT
A DAMA E O VAGABUNDO;WALT DISNEY
A DE ANA;CATHERINE RAMBERT
A E I O U – HISTÓRIA DAS CINCO VOGAIS;LUÍSA DACOSTA
A ERVA MILAGROSA;ROSA LOBATO FARIA
A ESCOLA DOS PIRATAS I;SIR STEVE STEVENSON
À ESPERA DO PAI NATAL;STEVE METZGER
A ESTRANHA VISITA;GRACIA IGLESIAS
A ESTRELA CADENTE  ;HOLLY LANSLEY
A ESTRELA DE LAURA;KLAUS BAUMGART
A ESTRELINHA PÁLIDA;PEDRO SEROMENHO
A EXPLORAÇÃO DO ESPAÇO;DAVID SHAYLER
A FÁBRICA DOS CORAÇÕES;ARTURO ABAD
A FADA CAROLINA;EMMA THOMSON
A FADA DO DENTINHO;JANEY LOUISE JONES
A FADA DOS DENTES;LUÍSA DACOSTA
A FADA DOS DENTES ;LUÍSA DACOSTA
A FADA ORIANA;SOPHIA DE MELLO BREYNER ANDRESEN
A FADA PALAVRINHA E O GIGANTE DAS BLIBLIOTECAS;LUÍSA DACOSTA
A FADA PARTIU A ASA;MUNDOS DE VIDA
A FAMÍLIA MONSTRO - A MALDIÇÃO DO OFELIAKROM;BRUNO MATOS
A FAMÍLIA MONSTRO - O TORNEIO DOS FEITICEIROS;BRUNO MATOS
A FAMÍLIA MONSTRO - O TORNEIO DOS FEITICEIROS ;BRUNO MATOS
A FAMÍLIA ROBINSON;JOHANN WYSS
A FAMÍLIA SOLUAS;MARIA DE LOURDES SOARES
A FAMOSA ESCOLA COR-DE-ROSA ;PEDRO LEITÃO
A FERA DO PALÁCIO;DAVID WALLIAMS
A FESTA DE ANOS;LUÍSA DACOSTA
A FESTA DE ANOS DO TOMÁS ;HELENA SIMAS
A FILHA DO GRUFALÃO;JULIA DONALDSON
A FILHA DO GRUFALÃO ;JULIA DONALDSON
A FLAUTA MARAVILHOSA;ANTÓNIO MOTA
A FLOR VAI VER O MAR;ALVES REDOL
A FLORESTA;SOPHIA DE MELLO BREYNER ANDRESEN
A FLORESTA;VALÉRIE VIDEAU
A FORMIGA HORRIPILANTE;LIZ PICHON
A FORMIGUINHA DESCALÇA;MATILDE ROSA ARAÚJO
A FUGA DA ERVILHA;PEDRO SEROMENHO E PATRÍCIA FIGUEIREDO
A GALINHA DOS OVOS DE OIRO;WALT DISNEY
A GALINHA DOS OVOS DOURADOS;ANA MARIA MAGALHÃES
A GALINHA MEDROSA ;ANTÓNIO MOTA
A GALINHA RUIVA;ANTÓNIO TORRADO
A GALINHA RUIVA;LEO TIMMERS
A GANSA DOS OVOS DE OURO;HARPREET KAUR
A GARRAFA MÁGICA ;SARA RODI
A GATA BORRALHEIRA;CHARLES PERRAULT
A GATA GATILDE;ANA MARIA MAGALHÃES E ISABEL ALÇADA
A GATA TARECA E OUTROS POEMAS LEVADOS DA BRECA;LUÍSA DACOSTA
A GATINHA CELESTE;RUBÉN PUJOL
A GATINHA DE NATAL;CAROLINE REPCHUCK
A GIGANTESCA PEQUENA COISA ;BEATRICE ALEMAGNA
A GIRAFA QUE COMIA ESTRELAS;JOSÉ EDUARDO AGUALUSA
A GIRAFA QUE QUERIA TER RISCAS;MARGARIDA JOSUÉ
A GRANDE BIRRA;TOM JAMIESON
A GRANDE FÁBRICA DE PALAVRAS;AGNÈS DE LESTRADE
A GRANDE MISSÃO;RITA GUAPO
A GRANDE RECOMPENSA;BARBARA O' CONNOR
A GRANDE VIAGEM À VOLTA DO MUNDO;GERONIMO STILTON
A GUERRA DAS FADAS;HERBIE BRENNAN
A GUERRA DOS NÚMEROS;JUAN DARIÉN
A HISTÓRIA DA CAROCHINHA;ISABEL PIZARRO MADUREIRA E LÚCIA VIDAL SOARES
A HISTÓRIA DA CAROCHINHA E DO INFELIZ DO JOÃO RATÃO;ANTÓNIO TORRADO
A HISTÓRIA DA JÚLIA E DA SUA SOMBRA DE MENINO;CHRISTIAN BRUEL
A HISTÓRIA DA PAPOILA;LUÍSA DACOSTA
A HISTÓRIA DAS CINCO VOGAIS;LUÍSA DACOSTA
A HISTÓRIA DE D. CARLOS;RUI RAMOS
A HISTÓRIA DE UM BOTÃO;MARIA JOÃO CARVALHO
A HISTÓRIA DE VAN GOGH E O RAPAZ DOS GIRASSÓIS;LAURENCE ANHOLT
A HISTÓRIA DO NATAL;SÉRGIO FRANCLIM
A HISTÓRIA DO PEDRITO COELHO;BEATRIX POTTER
A HISTÓRIA DO PEDRITO COELHO;BEATRIZ POTTER
A HISTÓRIA DO PLANETA TERRA;ABIGAIL WHEATLEY
A HORTA DO CHICÃO;RITA FREITAS
A HORTA DO SIMÃO;ROCÍO ALEJANDRO
A ILHA DO AVÔ;BENJI DAVIES
A ILHA DOS GUARDADORES DE ARANHAS;MARGARIDA ARAÚJO E JOÃO HOFFMAN
A ILHA DOS PÁSSAROS DOIDOS;CLARA PINTO CORREIA
A ILHA NEGRA ;HERGÉ
A INCRÍVEL FUGA DO MEU AVÔ;DAVID WALLIAMS
A JOANINHA VAIDOSA;ANA MARIA MAGALHÃES E ISABEL ALÇADA
A LAGARTINHA MUITO COMILONA;CHRISTIAN VOLTZ
A LEBRE E A TARTARUGA;ANA OOM
A LENDA DOS TRIPEIROS;ANA OOM
A LINDA SUSANA E OUTRAS HISTÓRIAS;ANTÓNIO TORRADO
A MAIOR FLOR DO MUNDO;JOSÉ SARAMAGO
A MALA ASSOMBRADA;DAVID MACHADO
A MALDIÇÃO DA ESTRELA MORTA (CRÓNICAS DO VAMPIRO VALENTIM);ALVARO MAGALHÃES
A MAMÃ PÔS UM OVO;BABETTE COLE
A MANTA;ISABEL MINHÓS MARTINS
A MANTA DO JOSÉ ;MIGUEL GOUVEIA
A MÁQUINA DE FAZER PALAVRAS;JOSÉ VAZ
A MARATONA MAIS LOUCA DO MUNDO!;GERONIMO STILRON
A MARATONA MAIS LOUCA DO MUNDO!;GERONIMO STILTON
A MARATONA MAIS LOUCA DO MUNDO! ;GERONIMO STILRON
A MARATONA MAIS LOUCO DO MUNDO! ;GERONIMO STILRON
A MARIANA E A LARA ZANGAM-SE;CHRISTIAN LAMBLIN
A MENINA COM OS OLHOS OCUPADOS;ANDRÉ CARRILHO
A MENINA DAS ROSAS;JOÃO M. RIBEIRO
A MENINA DO MAR;SOPHIA DE MELLO BREYNER ANDRESEN
A MENINA E OS TRÊS URSINHOS;VAIJAYANTI SAVANT TONPE 
A MENINA GOTINHA DE ÁGUA;PAPIANO CARLOS
A MENINA GOTINHA DE ÁGUA;PAPINIANO CARLOS
A MENINA QUE DESENHAVA CORAÇÕES;SÓNIA SOUSA
A MENINA QUE DETESTAVA LIVROS;MANJUSHA PAWAGI
A MENINA QUE NÃO GOSTAVA DE FRUTA;CIDÁLIA FERNANDES
A MENINA QUE NÃO QUERIA LIVROS;LUÍSA DACOSTA
A MENINA QUE NÃO SABIA CONTAR;ELISABETE PEREIRA
A MENINA QUE QUERIA SER MAÇÃ;JOSÉ EDUARDO AGUALUSA
A MENINA QUE SORRIA A DORMIR;ISABEL ZAMBUJAL
A MIGRAÇÃO DAS ALFORRECAS;RUI CERQUEIRA COELHO
A MINHA  ENCICLOPÉDIA  DOS  ANIMAIS;STEPHANIE LEDU
A MINHA CASA ASSOMBRADA;ANGIE SAGE
A MINHA ESCOLA DAVA UM FILME;JR. RODRY
A MINHA MÃE;ANTHONY BROWNE
A MINHA MÃE É A MELHOR DO MUNDO;MARIA JOÃO LOPO DE CARVALHO
A MINHA PRIMEIRA BIBLIOTECA - O MUNDO EM QUE VIVEMOS  ;ROGÉRIO MOREIRA
A MINHA PRIMEIRA ENCICLOPÉDIA DE GEOGRAFIA;VÁRIOS
A MINHA PRIMEIRA ENCICLOPÉDIA DOS OCEANOS E DOS MARES;BEN DENNE
A MINHA PROFESSORA É UM MONSTRO!;PETER BROWN
A MINHA TERRA;ALAIN CORBEL E JOÃO PAULO COTRIM
A MINHA VIDA É UM FILME;PAULA PIMENTA
A MINHA VIDA É UM FILME ;PAULA PIMENTA
A MONTANHA DE LIVROS MAIS ALTA DO MUNDO;ROCIO BONILLA
A MORCEGUITA DESTRAMBELHADA;ISABEL RICARDO
A MOSQUITO;INÊS DE OLIVEIRA
A MÚMIA SEM NOME;GERONIMO STILTON
A NAMORADA JAPONESA DO MEU AVÔ;JOSÉ FANHA
A NASCENTE DE TINTA;PEDRO SEROMENHO
A NATUREZA- RESPOSTAS ÀS PERGUNTAS DAS CRIANÇAS;EMMANUELLE PAROISSIEN
A NOITE DE NATAL;CLEMENT C. MOORE
A NOITE DE NATAL;SOPHIA DE MELLO BREYNER ANDRESEN
A NOITE DE NATAL ;SOPHIA DE MELLO BREYNER ANDRESEN
A NOITE DE NATAL DO OLAF;JESSICA JULIUS
A NOITE DE NATAL DO PALHAÇO JOÃO-SURPRESA;DUGALD STEER
A NOITE DOS ANIMAIS INVENTADOS;DAVID MACHADO
A ODISSEIA DE HOMERO;JOÃO DE BARROS
A OFICINA DO PAI NATAL;CRISTINA QUENTAL E MARIANA MAGALHÃES
A OFICINA DO SENHOR SARAIVA;ANA NOBRE DE GUSMÃO
A ORQUESTRA;AVALON
A OVELHA  QUE CHOCOU UM OVO;GEMMA MERINO
A OVELHA CURIOSA;ANA MARIA MAGALHÃES E ISABEL ALÇADA
A OVELHA QUE FAZIA MÚUU!;ISABEL FERNANDES PINTO
A OVELHINHA PRETA;ELIZABETH SHAW
A OVELHINHA PRETA ;ELIZABETH SHAW
A OVELHINHA QUE VEIO PARA O JANTAR;STEVE SMALLMAN
A PAIXÃO DO EUROPEU;PAULO CATARRO
A PEQUENA  SEREIA;HANS CHRISTIAN ANDERSEN
A PEQUENA ÁRVORE DE NATAL- UMA HISTÓRIA DE NATAL COM UM TOQUE DE MAGIA;DUGALD STEER
A PEQUENA SEMENTE;ERIC CARLE
A PEQUENA SEREIA;ANA OOM
A PEQUENA SEREIA;HANS CHRISTIAN ANDERSEN
A PEQUENA SEREIA;MEGAN E. BRYANT
A PEQUENA SEREIA;VÁRIOS
A PEQUENA SEREIA;WALT DISNEY
A PIOR AMIGA;FERNANDO CARVALHO
A PIOR BANDA DO MUNDO - VOL. 2;JOSÉ CARLOS FERNANDES
A PRIMEIRA NOITE DE AULAS;JO HOESTLANDT
A PRINCESA BAIXINHA;BEATRICE MASINI
A PRINCESA CARLOTA E O BAILE DE ANIVERSÁRIO;VIVIAN FRENCH
A PRINCESA CATARINA E O PÓNEI PRATEADO;VIVIAN FRENCH
A PRINCESA DA CHUVA;LUÍSA DACOSTA
A PRINCESA DA NEVE;EMILY HAWKINS
A PRINCESA E A ERVILHA;HANS CHRISTIAN ANDERSEN
A PRINCESA E A ERVILHA E OUTROS CONTOS;HANS CHRISTIAN ANDRESEN
A PRINCESA E A PORQUINHA;POLY BERNATENE E M. SANTOS CORREIA
A PRINCESA E O SAPO;ANA OOM
A PRINCESA E O SAPO;ANA SALDANHA
A PRINCESA E O SAPO;WALT DISNEY
A PRINCESA E O SAPO;WILL EISNER
A PRINCESA E O UNICÓRNIO;NICOLA BAXTER
A PRINCESA EM BUSCA DA FELICIDADE ;ULF STARK
A PRINCESA QUE NÃO SABIA ESPIRRAR;JOSÉ CAÑAS
A PRINCESA QUE QUERIA SER REI;SARA MONTEIRO
À PROCURA DE CASA;GERONIMO STILTON
À PROCURA DE NEMO;WALT DISNEY
A QUE SABE A LUA? ;MICHAEL GREJNIEC
A QUINTA DO SENHOR FRANCISCO;DELPHINE LACHARRON
A QUINTA DOS ANIMAIS;GEORGE ORWELL
A RÃ ATREVIDA ;ANA MARIA MAGALHÃES E ISABEL ALÇADA
A RÃ QUE QUERIA SER MAIOR DO QUE O BOI;LA FONTAINE
A RAINHA DA NEVE;HANS CHRISTIAN ANDERSEN
A RAINHA DO NORTE;JOANA ESTRELA
A RAPARIGA DA LIVRARIA;SYLVIA BISHOP
A RAPARIGA E O SONHO;LUÍSA DACOSTA
A RAPARIGA REBELDE - AVENTURAS NA ESCOLA;ENID BLYTON
A RAPARIGA REBELDE BRILHA NA ESCOLA ;ENID BLYTON
A RAPARIGA REBELDE QUER VENCER;ENID BLYTON
A RAPOSA - UMA HISTÓRIA SOBRE O CICLO DA VIDA ;ISABEL THOMAS E DANIEL EGNEU
A RAPOSA AZUL;ANA MARIA MAGALHÃES E ISABEL ALÇADA
A RAPOSA DAS BOTAS ALTAS;ANTÓNIO TORRADO
A RAPOSA E A CEGONHA;MAIRI MASHINNON
A RAPOSINHA MATREIRA TORNOU-SE CANTADEIRA;CARLOS NUNO GRANJA
A REVOLTA DOS VEGETAIS;DAVID ACEITUNO
A RIMA DO ROMEU;ERIC MANY
A RITA ENCOLHEU, E AGORA?;MARTA HUGON
A RODA DOS ANIMAIS;JOHNNY MORRIS
A SAGA DO TIO PATINHAS ;DON ROSA
A SEMANA DOS NOVE DIAS;VERGÍLIO ALBERTO VIEIRA
A SEMENTE MÁGICA;DANIEL MARQUES FERREIRA
A SINFONIA DOS ANIMAIS;DAN BROWN
A SOPA DE PEDRA;MIGUEL BORGES
A SOPA QUEIMA;PABLO ALBO
A SOPA VERDE;CHICO
A SURPRESA DE HANDA;EILEEN BROWNE
A TEIA DA CARLOTA;E.B.WHITE
A TEIA DE CARLOTA;E.B.WHITE
A TERRA DA MENTEMÁTICA;PAULO SOUSA E INÊS GUIMARÃES
A TERRA DO ARCO-ÍRIS OU DO ARCO-DA-VELHA;CARLOS PAIXÃO
A TERRA QUE O ZÊZERE ESCONDEU;ARMANDO COTRIM
A TERRA QUE O ZÊZERE ESCONDEU ;ARMANDO COTRIM
A TERRÍVEL TIA ALBERTA;DAVID WALLIAMS
A TOUPEIRA QUE QUERIA SABER QUEM LHE FIZERA AQUILO NA CABEÇA;WERNER HOLZWARTH
A TROMPA DOURADA DO ELEFANTE GIGANTE;CARLOS NUNO GRANJA
A TURMA DA MÓNICA - CADA UM NA SUA HISTÓRIA;MAURICIO DE SOUSA
A ÚLTIMA MISSÃO;CHANTAL DE SPIEGELEER
A ÚLTIMA VIAGEM DO NAVIO FANTASMA;GABRIEL GARCÍA MÁRQUEZ
A VACA GORDINHA;DAVID PALOMA
A VACA QUE SUBIU A UMA ÁRVORE;GEMMA MERINO
A VERDADEIRA HISTÓRIA DE GERONIMO STILTON;CUSCACÚSQUI RATATZ
A VERDADEIRA HISTÓRIA DO PAI NATAL;ALEXANDRE SANTOS LOBÃO
A VERDADEIRA HISTÓRIA DOS TRÊS PORQUINHOS ;JON SCIESZKA E LANE SMITH
A VERDADEIRA VIDA DA FORMIGA RABIGA;VIOLETA FIGUEIREDO
A VIAGEM ;FRANCESCA SANNA
A VIAGEM DO SENHOR PNEU;VANDA COSTA
A VIAGEM FANTÁSTICA DO PANDA;ULF STARK
A VIAGEM NO CARRO ENCARNADO;PEDRO LEITÃO
A VIAGEM NO TEMPO;ANA MARIA MAGALHÃES E ISABEL ALÇADA
A VIDA DÍFICIL DE UMA MANTEIGUEIRA;ISABEL ZAMBUJAL
A VIDA SECRETA DOS ANIMAIS NA QUINTA;MICHEL CUISIN
A VIDA SECRETA DOS ANIMAIS NOS LAGOS E NOS RIOS;MICHEL CUISIN
A VIÚVA E O PAPAGAIO;VIRGINIA WOOLF
A VIÚVA E O PAPAGAIO ;VIRGINIA WOOLF
A VOAR BEM ALTO ;TITANIA WOODS
A VOLTA À GÁLIA DE ASTÉRIX;ALBERT UDERZO E RENÉ GOSCINNY
A VOLTA AO MUNDO EM 80 DIAS;JÚLIO VERNE
A VOLTA AO MUNDO EM 80 DIAS ;JÚLIO VERNE
A VOVÓ ENSINA-TE A ORGANIZAR FESTAS;MARIA ISABEL LOUREIRO
A ZEBRA CAMILA;MARISA NÚÑEZ
ABADA DE HISTÓRIAS;ANTÓNIO MOTA
ABC DAS FLORES E DOS FRUTOS;ROSA LOBATO FARIA
ABC DAS FLORES E DOS FRUTOS  ;ROSA LOBATO FARIA
ABC DOS BICHOS EM RIMA INFANTIL;ROSA LOBATO FARIA
ABECEDÁRIO MALUCO;LUÍSA DACOSTA
ABIGAIL, A FADAZINHA DA ARAGEM;DAISY MEADOWS
ABRE COM MUITO CUIDADO;NICOLA O' BYRNE
ACADEMIA BAKER STREET- SHERLOCK HOLMES E A MALDIÇÃO DE BAKER STREET;SAM HEARN
ACHO QUE POSSO AJUDAR;DAVID MACHADO
ADELINO, O GIRINO;ANTOON KRINGS
ADEUS, PEÚGAS;BENJAMIN CHAUD
ADIVINHA QUANTO EU GOSTO DE TI NO OUTUNO;SAM MCBRATNEY
ADIVINHA, ADIVINHA;LUÍSA DACOSTA
ADORO YOGA;LORENA PAJALUNGA
ADORO-TE, PAI;JOANNA WALSH
AGENTE SECRETO ZERO ZERO KAPPA;GERONIMO STILTON
AGORA A SÉRIO NÃO ABRAS ESTE LIVRO;ANDY LEE
AGORA A SÉRIO, NÃO ABRAS ESTE LIVRO;ANDY LEE
AI AI AI, QUE MAL QUE ISTO VAI!;GERONIMO STILTON
AI QUISESTE IR DE FÉRIAS, STILTON?;GERONIMO STILTON
AÍ VEM HÉRCULES!;STELLA TARAKSON
AINDA NADA? ;CHRISTIAN VOLTZ
AJUDARIS'20 - HISTÓRIAS DA AJUDARIS;VÁRIOS
ALADDIN;WALT DISNEY
ALADDIN E O PEQUENO DROMEDÁRIO BRANCO;WALT DISNEY
ALADINO E A LÂMPADA MÁGICA;HELGA GEBERT
ALANA - A BAILARINA DA ÁGUA;ALICE CARDOSO
ALANA E A FESTA DA COR;ALICE CARDOSO
ALANA E AS ALGAS MISTERIOSAS;ALICE CARDOSO
ALBERTO  E  A  ÁRVORE  DE   NATAL;CIDÁLIA FERNANDES
ALBERTO NA ANTÁRCTIDA;CIDÁLIA FERNANDES
ALERTA SALTITÃO;ENID BLYTON
ALFABETO DE ADIVINHAS;JOÃO MANUEL RIBEIRO
ALI BABÁ E OS QUARENTA LADRÕES;LUC LEFORT
ALI BABÁ E OS QUARENTA LADRÕES;WALT DISNEY
ALIBABÁ E OS 40 LADRÕES;ADAPTAÇÃO DE ANA OOM
ALICE 4 - UM ANIVERSÁRIO ESPECIAL;RITA VILELA
ALICE 7 - UM NATAL BRANCO;RITA VILELA
ALICE NO PAÍS DAS MARAVILHAS;LEWIS CARROLL
ALICE NO PAÍS DAS MARAVILHAS;WALT DISNEY
ALICE NO PAÍS DO CANCRO ;SOPHIE BUYSE E MARTINE HENNUY 
AMAR À VISTA ;JORGE SERAFIM
AMAR-TE-EI PARA SEMPRE;MELANIE JOYCE 
AMÉLIA CANINA E O BAILE MEDONHO;LAURA ANDERSON
AMÉLIA QUER UM CÃO;TIM BOWLEY
AMIGOS;ERIC CARLE
AMIGOS ATÉ À HORA DO ALMOÇO;RODOLFO CASTRO
AMIGOS DAS ESTRELAS;TRACEY CORDEROY
AMONG US - UM TRAIDOR NO ESPAÇO ;LAURA RIVIÈRE
AMOR MONSTRO;RACHEL BRIGHT
ANA GOTINHA DE ÁGUA;ANA MAFALDA DAMIÃO
ANDRÉ E O ALEGRIÃO;SATOSHI KITAMURA E HIAWYN ORAM
ANEDOTAS DE FUTEBOL ILUSTRADAS;TIAGO SALGUEIRO
ANFÍBIOS;BARRY CLARKE
ANGRY BIRDS - AS AVENTURAS DE STELLA - OS CAÇADORES DO OVO DE JADE VOLUME 2;ANGRY BIRDS
ANIMAIS DA SELVA- O LEÃO;VÁRIOS
ANIMAIS DO MAR;VÁRIOS
ANIMAIS FOFINHOS ;MELANIE JOYCE
ANIMAIS MARINHOS;MARINE LE SAOUT
ANIMAIS MUITO ESPECIAIS;LELARGE ET AL.
ANIMAIS- PERGUNTAS E RESPOSTAS NUM MINUTO;YOYO STUDIOS
ANITA A CAVALO;GILBERT DELAHAYE
ANITA APRENDE A NADAR;GIBERT DELAHAYE 
ANITA APRENDE A NADAR;GILBERT DELAHAYE
ANITA BABY-SITTER;GILBERT DELAHAYE
ANITA DONA DE CASA;GILBERT DELAHAYE
ANITA E A FESTA DE ANOS;GILBERT DELAHAYE
ANITA E A NOITE DE NATAL;GILBERT DELAHAYE
ANITA E A SURPRESA;GILBERT DELAHAYE
ANITA E A TIA LÚCIA;GILBERT DELAHAYE
ANITA E A VISITA DE ESTUDO;GILBERT DELAHAYE
ANITA E A VIZINHA DO LADO;GILBERT DELAHAYE
ANITA E AS QUATRO ESTAÇÕES;GILBERT DELAHAYE
ANITA E O BAILE DE MÁSCARAS;GILBERT DELAHAYE
ANITA E O DIA DA MÃE;GILBERT DELAHAYE
ANITA E O DIA DA MÃE ;GILBERT DELAHAYE
ANITA E O PARDALITO;GILBERT DELAHAYE
ANITA E OS FANTASMAS ;GILBERT DELAHAYE
ANITA E UM DOMINGO DIFERENTE;GILBERT DELAHAYE
ANITA ESTÁ DOENTE;GILBERT DELAHAYE
ANITA MAMÃ;GILBERT DELAHAYE
ANITA NA COZINHA;GILBERT DELAHAYE
ANITA NA FESTA DAS FLORES ;GILBERT DELAHAYE
ANITA NA MONTANHA;GILBERT DELAHAYE
ANITA NA QUINTA;GILBERT DELAHAYE
ANITA NO BALLET;GILBERT DELAHAYE
ANITA NO CAMPO;GILBERT DELAHAYE
ANITA NO HOSPITAL;GILBERT DELAHAYE
ANITA NO JARDIM;GILBERT DELAHAYE
ANITA NO JARDIM ZOOLÓGICO;GILBERT DELAHAYE
ANITA VAI ÀS AULAS;GILBERT DELAHAYE
ANITA VAI ÀS COMPRAS;GILBERT DELAHAYE
ANJOS DE PIJAMA;MATILDE ROSA ARAÚJO
ANNA & ELSA E O SEU NOVO AMIGO;JESSICA JULIUS
ANNA KADABRA - O CLUBE DA LUA CHEIA;PEDRO MAÑAS
ANNE FRANK - A MENINA QUE O MUNDO OUVIU;LINDA MARSHALL
APENAS UM DESEJO;BARBARA O' CONNOR
APRENDE E EXPLORA - O ESPAÇO- SISTEMA SOLAR;MATTEO GAULE
AQUELA NUVEM E OUTRAS;EUGÉNIO DE ANDRADE
AQUI D'EL REI;PAULA FERNANDES
AQUI ESTAMOS NÓS;OLIVER JEFFERS
AQUI HÁ GATO!;RUI LOPES
ARCA DE NOÉ;VINÍCIUS DE MORAES
ARCO, BARCO, BERÇO, VERSO;JOSÉ DE VASCONCELOS
ARIEL E A JÓIA AZUL - MARINHO;WALT DISNEY
ARIEL SALVA AS SEREIAS;WALT DISNEY
ARIEL, SALVA AS SEREIAS ;LIZ MARSHAM
ARREPIOS - O ABOMINÁVEL HOMEM DAS NEVES DE PASADENA;R. L. STINE
ARREPIOS - TERRORLÂNDIA;R. L. STINE
ÁRVORES NO CAMINHO  ;VANINA STARKOFF
AS ANDANÇAS DO SENHOR FORTES;ANTÓNIO MOTA
AS ARMADILHAS DA FLORESTA;ANTÓNIO MANUEL COUTO VIANA
AS AVENTURAS DA ENGRÁCIA;MARIA ALBERTA MENÉRES
AS AVENTURAS DA PEQUENA SEREIA - BRACELETE;WALT DISNEY
AS AVENTURAS DAS TEA SISTERS - MISTÉRIO EM PARIS;TEA STILTON
AS AVENTURAS DE HOMEDONTE - A TIA NÉVOA;JOSÉ ABRANTES
AS AVENTURAS DE JULES VERNE - VIAGEM AO ABISMO;CAPITÃO NEMO
AS AVENTURAS DE MIKE;GABRIEL DEARO E MANU DIGILIO
AS AVENTURAS DE PINÓQUIO;CARLO COLLODI
AS AVENTURAS DE TACHI, O GRILO TIBETANO;TSERING PALDRON
AS AVENTURAS DE TOM SAWER;MARK TWAIN
AS AVENTURAS DE TOM SAWYER;MARK TWAIN
AS AVENTURAS DE VÍTOR  E OS PIRATAS ;JAN EVANS
AS AVENTURAS DE VÍTOR E A BRUXA;JAN IVENS
AS AVENTURAS DE VÍTOR NA QUINTA;JAN EVANS
AS AVENTURAS DO CAPITÃO CUECAS;DAV PILKEY
AS AVENTURAS DO CAPITÃO CUECAS AGORA A CORES!;DAV PILKEY
AS AVENTURAS DO CAPITÃO CUECAS AGORA A CORES!;DAVE PILKEY.
AS AVENTURAS DO CAPITÃO CUECAS AGORA A CORES! ;DAV PILKEY
AS AVENTURAS DO CAPITÃO DENTINHO- O MISTÉRIO DA ESCOVA DESAPARECIDA;PEDRO FERREIRA LOPES
AS AVENTURAS DO MENINO NICOLAU;RENÉ GOSCINNY
AS AVENTURAS DO SUPER-BEBÉ FRALDINHA;DAV PILKEY
AS AVENTURAS DOS GÉMEOS PINHEIRO-BRAVO- OS GÉMEOS SEGUEM UM TIGRE;CRESSIDA COWELL
AS AVENTURAS DOS GÉMEOS TREETOP - OS GÉMEOS ENCONTRAM DOIS TIRANOSSAUROS;CRESSIDA COWELL
AS AVENTURAS DOS QUATRO GÉMEOS - FÉRIAS NA QUINTA  ;LAURA HOPE
AS CANÇÕEZINHAS DA TILA;MATILDE ROSA ARAÚJO
AS CINCO ÂNFORAS DE OURO;JOANA LUÍSA MATOS
AS CONSULTAS DO DR. SERAFIM E A BRONQUITE DA SENHORA ADRIANA (ONOMATOPEIAS E PONTUAÇÃO);ROSÁRIO ALÇADA ARAÚJO
AS COZINHEIRAS DE LIVROS;MARGARIDA BOTELHO
AS CRÓNICAS DE NARNIA - O PRÍNCIPE CASPIAN;C.S. LEWIS
AS CRÓNICAS DE NÁRNIA- O SOBRINHO DO MÁGICO;C. S. LEWIS
AS EMOÇÕES DO GASTÃO;AURÉLIE CHIE
AS EMOÇÕES DO PEQUENO GATO EGOÍSTA;AUDREY BOUQUET, FABIEN LAMBERT
AS FADAS;CALOUAN ET AL.
AS FADAS FALAM-NOS DE ... GRATIDÃO;ALEIX CABRERA E ROSA MARIA CURTO
AS FADAS FALAM-NOS DE GENEROSIDADE;ALEIX CABRERA E ROSA MARIA CURTO
AS FADAS VERDES;MATILDE ROSA ARAÚJO
AS FERAS DO FUTEBOL CLUBE NÍVEL 2.01 - O FLAGELO DO TROVÃO;JOACHIM MASANNEK
AS FÉRIAS DO PAI NATAL;LOURDES CUSTÓDIO
AS FÉRIAS DO PEQUENO URSO;BENJAMIN CHAUD
AS FLORES TAMBÉM SONHAM;CELESTE DE ALMEIDA GONÇALVES
AS GÉMEAS - O  TERCEIRO ANO EM SANTA CLARA;ENID BLYTON
AS GÉMEAS - O SEGUNDO ANO EM SANTA CLARA;ENID BLYTON
AS GÉMEAS - O SEXTO ANO NO COLÉGIO DE SANTA CLARA;ENID BLYTON
AS GÉMEAS - O TERCEIRO PERÍODO EM SANTA CLARA;ENID BLYTON
AS GÉMEAS FAZEM ANOS;ANA MARIA MAGALHÃES E ISABEL ALÇADA
AS GÉMEAS- O PRIMEIRO ANO EM SANTA CLARA;ENID BLYTON
AS GÉMEAS VOLTAM AO COLÉGIO;ENID BLYTON
AS GIRAFAS NÃO DANÇAM;GILES ANDREAE
AS GRAVATAS DO MEU PAI;PEDRO SEROMENHO
AS HISTÓRIAS DO AVOZINHO;RAUL CORREIA
AS HISTORIAZINHAS DO GUALTER;NANCY HALL
AS INCRÍVEIS FÉRIAS NA PENSÃO MIRARRATOS;GERONIMO STILTON
AS MAIS BELAS COISAS DO MUNDO;VALTER HUGO MÃE
AS MAIS BELAS FÁBULAS DE ESOPO;VÁRIOS
AS MAIS BELAS HISTÓRIAS DE NATAL;VÁRIOS
AS MAIS BELAS HISTÓRIAS DE RUBEM ALVES;RUBEM ALVES
AS MÃOS NÃO SÃO PARA BATER;MARTINE AGASSI
AS MELHORES AMIGAS;NESSA WILLIAMS E PHILIPA WINGATE
AS MELHORES PIADAS DOS MEUS LEITORES;GERONIMO STYLTON
AS MINHAS 100 PRIMEIRAS PALAVRAS;VÁRIOS
AS MINHAS EMOÇÕES;AURÉLIE CHIEN CHOW CHINE
AS MINHAS INCRÍVEIS FÉRIAS DE VERÃO;DAVIDE CALI
AS PALAVRAS ESQUECIDAS;MUNDOS DE VIDA
AS PIORES CRIANÇAS DO MUNDO;DAVID WALLIAMS
AS PIORES CRIANÇAS DO MUNDO 2;DAVID WALLIAMS
AS PREOCUPAÇÕES DO BILLY;ANTHONY BROWNE
AS PRINCESAS E AS CORES;WALT DISNEY
AS PROFISSÕES;SYLVIE BAUSSIER
AS REGRAS DA PRINCESA;PHILIPPA GREGORY
AS ROSAS INGLESAS;MADONNA
AS TRAPALHADAS DA BRUXA MIMI;LAURA OWEN
AS VIAGENS DE GULIVER;JONATHAN SWIFT
ASSASSINATION CLASSROOM - HORA PARA MATAR;YUSEI MATSUI
ASSIM COMEÇA A VIDA ;ANA CRISTINA SILVA
ASSIM OU ASSADO;ANA PESSOA
ASTÉRIX - A FILHA DE VERCINGÉTORIX;JEAN-YVES FERRI
ASTÉRIX - A FOICE DE OURO;ALBERT UDERZO E RENÉ GOSCINNY
ASTÉRIX - A ZARAGATA;ALBERT UDERZO E RENÉ GOSCINNY
ASTÉRIX - ASTÉRIX E A CLEÓPATRA;ALBERT UDERZO E RENÉ GOSCINNY
ASTÉRIX - ASTÉRIX E CLEÓPATRA ;ALBERT UDERZO E RENÉ GOSCINNY
ASTÉRIX - ASTÉRIX E O CALDEIRÃO MÁGICO;ALBERT UDERZO E RENÉ GOSCINNY
ASTÉRIX - ASTÉRIX E O GRIFO;RENÉ GOSCINNY ET AL.
ASTÉRIX - ASTÉRIX E O REGRESSO DOS GAULESES;ALBERT UDERZO E RENÉ GOSCINNY
ASTÉRIX - ASTÉRIX ENTRE OS BRETÕES;ALBERT UDERZO E RENÉ GOSCINNY
ASTÉRIX - ASTÉRIX ENTRE OS PICTOS;ALBERT UDERZO E RENÉ GOSCINNY
ASTÉRIX - ASTÉRIX NA HISPÂNIA ;ALBERT UDERZO E RENÉ GOSCINNY
ASTÉRIX - ASTÉRIX NOS JOGOS OLÍMPICOS;ALBERT UDERZO E RENÉ GOSCINNY
ASTÉRIX - O ADIVINHO;ALBERT UDERZO E RENÉ GOSCINNY
ASTÉRIX - O ADIVINHO  ;ALBERT UDERZO E RENÉ GOSCINNY
ASTÉRIX - O CÉU CAI-LHE EM CIMA DA CABEÇA ;ALBERT UDERZO E RENÉ GOSCINNY
ASTÉRIX - O PRESENTE DE CÉSAR;ALBERT UDERZO E RENÉ GOSCINNY
ASTÉRIX E O CALDEIRÃO ;ALBERT UDERZO E RENÉ GOSCINNY
ASTÉRIX O GAULÊS;ALBERT UDERZO E RENÉ GOSCINNY
ASTÉRIX- O SEGREDO DA POÇÃO MÁGICA;OLIVIER GAY
ASTROLOGIA - TUDO O QUE PRECISA DE SABER;KATHLEEN SEARS
ASTROSSAUROS - O PLANETA PERIGOSO;STEVE COLE
ATAQUE CANINO;ANDREW CLOVER
ATENÇÃO À CAUDA, VÊM AÍ METEORITOS;GERONIMO STILTON
ATLÂNTIDA, O CONTINENTE PERDIDO;WALT DISNEY
ATLAS DA NATUREZA;JEAN DELAROCHE
ATLAS DAS BANDEIRAS;CLIVE GIFFORD
ATLAS DAS CRIANÇAS;VÁRIOS
ATLAS DO MUNDO;ARTE PLURAL - YOYO
ATLAS DOS ANIMAIS;TOMÁS TUMA
ATLAS DOS ANIMAIS ;GERONIMO STILTON
ATLAS ILUSTRADO;BRIAN DELF
ATLAS ILUSTRADO DOS ANIMAIS ;BARBARA TAYLOR
ATLAS INFANTIL;BELINDA WEBER
ATTACK ON TITAN 32;HAJIME ISAYAMA
AUTHENTICGAMES - NAMORADA PERFEITA;MARCO TÚLIO
AUTHENTICGAMES - VIVENDO UMA VIDA AUTÊNTICA ;MARCO TÚLIO
AVE RARA!;ROCIO BONILLA
AVENTURA NA ÁRVORE!;BEATRIX POTTER
AVENTURAS DA CAUDA DO IGOR;ANN BRAYBROOKS
AVENTURAS DO PATO RAIMUNDO;BERNARDO PINTO DE ALMEIDA
AVENTURAS NA ESCOLA- UMA RAPARIGA REBELDE;ENID BLYTON
AVISO - NÃO TOCAR!;TIM WARNES
AVISO AO REI LEÃO;THEREZINHA CASASANTA
AVÓ SARILHO - A ESTRELA DA FESTA;SOPHY HENN
AVÓ SARILHO - MUITA IDADE, POUCO JUÍZO;SOPHY HENN
AVÔ, CONTA-ME OUTRA VEZ;JOSÉ LETRIA
AVÓS;CHEMA HERAS
AVOZINHA GÂNGSTER;DAVID WALLIAMS
BAILARINA MÁGICA - DELPHIE E O ESPECTÁCULO DE ANIVERSÁRIO;DARCEY BUSSEL
BAILARINA MÁGICA- ROSA E O PRÉMIO ESPECIAL;DARCEY BUSSELL
BALBÚRDIA;TERESA CORTEZ
BALEIAS GOLFINHOS E TONINHAS;BRONWYN SWEENEY
BAMBI;WALT DISNEY
BAMBI;
BARBAPAPA;TALUS TAYLOR E ANNETTE TISON
BARBIE - TU PODES SER GINASTA;VÁRIOS
BARBIE E AS AGENTES SECRETAS - MISSÃO JÓIAS PERDIDAS;VÁRIOS
BARBIE NO MUNDO DOS JOGOS ;VÁRIOS
BARBIE PRINCESA ROCK STAR - DUAS ESTRELAS UM DESTINO;VÁRIOS
BARRIGA DA BALEIA;ANTÓNIO JORGE GONÇALVES
BEATRIZ E O PLÁTANO;ILSE LOSA
BEATRIZ, USA O NARIZ!;ISABEL COUTO E RICARDO SANTOS
BEIJINHOS BEIJINHOS;SELMA MANDINE
BEIJINHOS NÃO DOU!;JULIA JARMAN
BEIJOS E BREJOS, OS PECEVEJOS;ANTOON KRINGS
BEM-VINDOS AO NOSSO MUNDO;MOIRA BUTTERFIELD
BEN 10 - AVENTURAS ALIENÍGENAS - OMNI-ILUSÃO ;VÁRIOS
BENEDITA CATITA E SEBASTIÃO ZANGÃO;JOSÉ BARROCO
BERNARDINO;MANUELA BACELAR
BERNARDO FAZ BIRRA;HIAWYN ORAM
BEYBLADE METAL FUSION - AO ATAQUE! O PODER DO TOURO!;TAKAFUMI ADACHI
BEYBLADE SHOGUN STEEL - CHEGA UMA NOVA ERA!;TAKAFUMI ADACHI
BFF - WOWCOME SUMMER!;MARIA DE CARVALHO
BIA - DE FÉRIAS COM AS AMIGAS;WALT DISNEY
BIA - O MEU PRIMEIRO AMOR;WALT DISNEY
BIA E O UNICORNIO;DANA SIMPSON
BIA E O UNICÓRNIO;DANA SIMPSON
BIA E O UNICÓRNIO -  SEGREDOS DE UNICÓRNIO;DANA SIMPSON
BIA E O UNICÓRNIO - A TEMPESTADE MÁGICA;DANA SIMPSON
